### ISSUE TITLE
Using BPF filter with not keyword or net mask

### ISSUE THREAD

**Issue by Snshadow** [packetcap/go-pcap#48]
Looks like setting BPF filter using "not" keyword and net mask does not work correctly. In tcpdump these BPF filters works correctly.
```
test@test:~/GitProject/go-pcap$ sudo tcpdump -i any "not net 127.0.0.0/8"
tcpdump: data link type LINUX_SLL2
tcpdump: verbose output suppressed, use -v[v]... for full protocol decode
listening on any, link-type LINUX_SLL2 (Linux cooked v2), snapshot length 262144 bytes
10:36:46.164536 ens32 Out IP test.ssh > _gateway.54080: Flags [P.], seq 1977339556:1977339640, ack 1936456696, win 65535, length 84
10:36:46.164831 ens32 In  IP _gateway.54080 > test.ssh: Flags [.], ack 84, win 64240, length 0
10:36:46.232912 ens32 Out IP test.38631 > _gateway.domain: 12017+ [1au] PTR? 2.46.168.192.in-addr.arpa. (54)
10:36:46.234333 ens32 In  IP _gateway.domain > test.38631: 12017 NXDomain 0/0/1 (54)
10:36:46.234467 ens32 Out IP test.38631 > _gateway.domain: 12017+ PTR? 2.46.168.192.in-addr.arpa. (43)
10:36:46.235756 ens32 In  IP _gateway.domain > test.38631: 12017 NXDomain 0/0/0 (43)
10:36:46.236849 ens32 Out IP test.55121 > _gateway.domain: 7120+ [1au] PTR? 130.46.168.192.in-addr.arpa. (56)
10:36:46.238146 ens32 In  IP _gateway.domain > test.55121: 7120 NXDomain 0/0/1 (56)
10:36:46.238274 ens32 Out IP test.55121 > _gateway.domain: 7120+ PTR? 130.46.168.192.in-addr.arpa. (45)
10:36:46.239678 ens32 In  IP _gateway.domain > test.55121: 7120 NXDomain 0/0/0 (45)
^C
10 packets captured
10 packets received by filter
0 packets dropped by kernel
```
```
test@test:~/GitProject/go-pcap$ sudo tcpdump -i any "net 127.0.0.0/8"
tcpdump: data link type LINUX_SLL2
tcpdump: verbose output suppressed, use -v[v]... for full protocol decode
listening on any, link-type LINUX_SLL2 (Linux cooked v2), snapshot length 262144 bytes
10:43:01.006039 lo    In  IP localhost.54190 > localhost.43791: Flags [P.], seq 3506288800:3506288844, ack 401878399, win 14838, options [nop,nop,TS val 3060264020 ecr 3060262360], length 44
10:43:01.006079 lo    In  IP localhost.43791 > localhost.54190: Flags [.], ack 44, win 11256, options [nop,nop,TS val 3060264020 ecr 3060264020], length 0
10:43:01.020768 lo    In  IP localhost.54190 > localhost.43791: Flags [P.], seq 44:89, ack 1, win 14838, options [nop,nop,TS val 3060264035 ecr 3060264020], length 45
10:43:01.020807 lo    In  IP localhost.43791 > localhost.54190: Flags [.], ack 89, win 11256, options [nop,nop,TS val 3060264035 ecr 3060264035], length 0
10:43:01.311493 lo    In  IP localhost.40273 > localhost.40802: Flags [P.], seq 631682537:631682585, ack 3573312487, win 24572, options [nop,nop,TS val 3060264326 ecr 3060262589], length 48
10:43:01.311525 lo    In  IP localhost.40802 > localhost.40273: Flags [.], ack 48, win 22004, options [nop,nop,TS val 3060264326 ecr 3060264326], length 0
^C
6 packets captured
12 packets received by filter
0 packets dropped by kernel
```

## Expected Behavior
- When using "not net 127.0.0.1" for BPF filter all packets from/to localhost should not be captured.
- When using ip address with netmask, packet should be filtered according to the given filter. For example, using "net 127.0.0.0/8" should capture packet from/to 127.0.0.(0~255).

## Actual Behavior
- Using "not net 127.0.0.1" actually captured packets from/to 127.0.0.1.
- _output_
```
test@test:~/GitProject/go-pcap$ sudo ./dist/pcap-linux-amd64 "not net 127.0.0.1"
capturing from interface 
INFO[0000] mmap buffer created at 0x7d89e49f0000 with size 131072  iface= promiscuous=false snaplen=1600 syscalls=false timeout=0s
0: IP packet From src [127 0 0 1] to dst [127 0 0 53]
0: UDP packet From src port 40373 to dst port 53
0: PACKET LAYER 0: Ethernet
0: PACKET LAYER 1: IPv4
0: PACKET LAYER 2: UDP
0: PACKET LAYER 3: DNS
0: packet size 0, first bytes [0 0 0 0 0 0 0 0 0 0 0 0 8 0 69 0 0 78 114 70 64 0 64 17 202 34 127 0 0 1 127 0 0 53 157 181 0 53 0 58 254 129 39 178 1 0 0 1 0 0]
1: IP packet From src [127 0 0 1] to dst [127 0 0 53]
1: UDP packet From src port 40373 to dst port 53
1: PACKET LAYER 0: Ethernet
1: PACKET LAYER 1: IPv4
1: PACKET LAYER 2: UDP
1: PACKET LAYER 3: DNS
1: packet size 0, first bytes [0 0 0 0 0 0 0 0 0 0 0 0 8 0 69 0 0 78 114 70 64 0 64 17 202 34 127 0 0 1 127 0 0 53 157 181 0 53 0 58 254 129 39 178 1 0 0 1 0 0]
2: IP packet From src [127 0 0 1] to dst [127 0 0 53]
2: UDP packet From src port 6226 to dst port 53
2: PACKET LAYER 0: Ethernet
2: PACKET LAYER 1: IPv4
2: PACKET LAYER 2: UDP
2: PACKET LAYER 3: DNS
2: packet size 0, first bytes [0 0 0 0 0 0 0 0 0 0 0 0 8 0 69 0 0 78 28 128 64 0 64 17 31 233 127 0 0 1 127 0 0 53 24 82 0 53 0 58 254 129 26 5 1 0 0 1 0 0]
3: IP packet From src [127 0 0 1] to dst [127 0 0 53]
3: UDP packet From src port 6226 to dst port 53
3: PACKET LAYER 0: Ethernet
3: PACKET LAYER 1: IPv4
3: PACKET LAYER 2: UDP
3: PACKET LAYER 3: DNS
3: packet size 0, first bytes [0 0 0 0 0 0 0 0 0 0 0 0 8 0 69 0 0 78 28 128 64 0 64 17 31 233 127 0 0 1 127 0 0 53 24 82 0 53 0 58 254 129 26 5 1 0 0 1 0 0]
4: IP packet From src [127 0 0 1] to dst [127 0 0 1]
4: TCP packet From src port 40802 to dst port 40273
4: PACKET LAYER 0: Ethernet
4: PACKET LAYER 1: IPv4
4: PACKET LAYER 2: TCP
4: PACKET LAYER 3: Payload
4: packet size 0, first bytes [0 0 0 0 0 0 0 0 0 0 0 0 8 0 69 0 0 96 144 88 64 0 64 6 172 61 127 0 0 1 127 0 0 1 159 98 157 81 212 252 79 248 37 163 175 95 128 24 85 244]
5: IP packet From src [127 0 0 1] to dst [127 0 0 1]
5: TCP packet From src port 40802 to dst port 40273
5: PACKET LAYER 0: Ethernet
5: PACKET LAYER 1: IPv4
5: PACKET LAYER 2: TCP
5: PACKET LAYER 3: Payload
5: packet size 0, first bytes [0 0 0 0 0 0 0 0 0 0 0 0 8 0 69 0 0 96 144 88 64 0 64 6 172 61 127 0 0 1 127 0 0 1 159 98 157 81 212 252 79 248 37 163 175 95 128 24 85 244]
6: IP packet From src [127 0 0 1] to dst [127 0 0 1]
6: TCP packet From src port 40802 to dst port 40273
6: PACKET LAYER 0: Ethernet
6: PACKET LAYER 1: IPv4
6: PACKET LAYER 2: TCP
6: PACKET LAYER 3: Payload
6: packet size 0, first bytes [0 0 0 0 0 0 0 0 0 0 0 0 8 0 69 0 0 96 144 89 64 0 64 6 172 60 127 0 0 1 127 0 0 1 159 98 157 81 212 252 80 36 37 163 175 95 128 24 85 244]
7: IP packet From src [127 0 0 1] to dst [127 0 0 1]
7: TCP packet From src port 40802 to dst port 40273
7: PACKET LAYER 0: Ethernet
7: PACKET LAYER 1: IPv4
7: PACKET LAYER 2: TCP
7: PACKET LAYER 3: Payload
7: packet size 0, first bytes [0 0 0 0 0 0 0 0 0 0 0 0 8 0 69 0 0 96 144 89 64 0 64 6 172 60 127 0 0 1 127 0 0 1 159 98 157 81 212 252 80 36 37 163 175 95 128 24 85 244]
^C
```
- Using "net 127.0.0.0/8" or other BPF filters with netmask captures nothing at all.
- _output_
```
sudo ./dist/pcap-linux-amd64 "net 127.0.0.0/8"
capturing from interface 
INFO[0000] mmap buffer created at 0x71b510af8000 with size 131072  iface= promiscuous=false snaplen=1600 syscalls=false timeout=0s
# no packets captured at all
```

## Steps to Reproduce the Problem

  1. Run sample binary pcap with "not net 127.0.0.1" as parameter and it captures all packets from/to 127.0.0.1.
  1. Run sample binary pcap with "net 127.0.0.0/8" as parameter and it captures nothing.

## Specifications

  - Version: v0.0.0-20231012071930-918558c1b3ad
  - Platform: Linux(VMware workstation 15)
  - Subsystem: Ubuntu 22.04.4 LTS amd64

**Comment by deitch** [comment]
It _should_ work, as the correct token is supported, see [here](https://github.com/packetcap/go-pcap/blob/master/filter/expression.go#L17C2-L17C9) and [here](https://github.com/packetcap/go-pcap/blob/master/filter/expression.go#L315-L317). Obviously something is mishandled about the [negator](https://github.com/packetcap/go-pcap/blob/master/filter/expression.go#L316).

If you can figure something out and get a PR in, that would be great. I will try to look as well, when I have time.

**Comment by deitch** [comment]
@Snshadow can you try the branch provided in #49 ?

**Comment by Snshadow** [comment]
The "not" keyword works in the branch from https://github.com/packetcap/go-pcap/pull/49. Thank you for checking.
_running output_
```
test@test:~/GitProject/go-pcap$ sudo ./dist/pcap-linux-amd64 "not net 127.0.0.1"
capturing from interface 
INFO[0000] mmap buffer created at 0x73818bea8000 with size 131072  iface= promiscuous=false snaplen=1600 syscalls=false timeout=0s
0: IP packet From src [192 168 46 2] to dst [192 168 46 130]
0: TCP packet From src port 62491 to dst port 22
0: PACKET LAYER 0: Ethernet
0: PACKET LAYER 1: IPv4
0: PACKET LAYER 2: TCP
0: PACKET LAYER 3: Payload
0: packet size 0, first bytes [0 12 41 168 86 216 0 80 86 232 71 85 8 0 69 0 0 164 229 174 0 0 128 6 118 208 192 168 46 2 192 168 46 130 244 27 0 22 60 253 101 44 74 228 2 230 80 24 250 240]
1: IP packet From src [192 168 46 130] to dst [192 168 46 2]
1: TCP packet From src port 22 to dst port 62491
1: PACKET LAYER 0: Ethernet
1: PACKET LAYER 1: IPv4
1: PACKET LAYER 2: TCP
1: packet size 0, first bytes [0 80 86 232 71 85 0 12 41 168 86 216 8 0 69 8 0 40 115 232 64 0 64 6 233 10 192 168 46 130 192 168 46 2 0 22 244 27 74 228 2 230 60 253 101 168 80 16 255 255]
2: IP packet From src [192 168 46 130] to dst [192 168 46 2]
2: TCP packet From src port 22 to dst port 62491
2: PACKET LAYER 0: Ethernet
2: PACKET LAYER 1: IPv4
2: PACKET LAYER 2: TCP
2: PACKET LAYER 3: Payload
2: packet size 0, first bytes [0 80 86 232 71 85 0 12 41 168 86 216 8 0 69 8 0 124 115 233 64 0 64 6 232 181 192 168 46 130 192 168 46 2 0 22 244 27 74 228 2 230 60 253 101 168 80 24 255 255]
3: IP packet From src [192 168 46 2] to dst [192 168 46 130]
3: TCP packet From src port 62491 to dst port 22
3: PACKET LAYER 0: Ethernet
3: PACKET LAYER 1: IPv4
3: PACKET LAYER 2: TCP
3: packet size 0, first bytes [0 12 41 168 86 216 0 80 86 232 71 85 8 0 69 0 0 40 229 175 0 0 128 6 119 75 192 168 46 2 192 168 46 130 244 27 0 22 60 253 101 168 74 228 3 58 80 16 250 240]
4: IP packet From src [192 168 46 130] to dst [192 168 46 2]
4: TCP packet From src port 22 to dst port 62491
4: PACKET LAYER 0: Ethernet
4: PACKET LAYER 1: IPv4
4: PACKET LAYER 2: TCP
4: PACKET LAYER 3: Payload
4: packet size 0, first bytes [0 80 86 232 71 85 0 12 41 168 86 216 8 0 69 8 0 124 115 234 64 0 64 6 232 180 192 168 46 130 192 168 46 2 0 22 244 27 74 228 3 58 60 253 101 168 80 24 255 255]
5: IP packet From src [192 168 46 2] to dst [192 168 46 130]
5: TCP packet From src port 62491 to dst port 22
5: PACKET LAYER 0: Ethernet
5: PACKET LAYER 1: IPv4
5: PACKET LAYER 2: TCP
5: packet size 0, first bytes [0 12 41 168 86 216 0 80 86 232 71 85 8 0 69 0 0 40 229 190 0 0 128 6 119 60 192 168 46 2 192 168 46 130 244 27 0 22 60 253 101 168 74 228 3 142 80 16 250 240]
```

However, in the case of using netmask in bpf filter, no packet is captured at all as mentioned above. 
Looking into the test cases in https://github.com/packetcap/go-pcap/blob/master/filter/compile_cases_test.go#L1125, the test in https://github.com/packetcap/go-pcap/blob/master/filter/compile_test.go#L166 passes with "net 192.168.0.0/24" without any issue, making it look like it should work. As I'm new to bpf filter, I would have to look how netmask works in bpf structure.

**Comment by deitch** [comment]
> However, in the case of using netmask in bpf filter, no packet is captured at all as mentioned above.
Looking into the test cases in https://github.com/packetcap/go-pcap/blob/master/filter/compile_cases_test.go#L1125, the test from https://github.com/packetcap/go-pcap/blob/master/filter/compile_test.go#L166-L178 passes with "net 192.168.0.0/24" without any issue, making it look like it should work. As I'm new to bpf filter, I would have to look how netmask works in bpf structure

Open a new issue on this.
